{
  "system_ref": "GLOBAL.OS",
  "domain_ref": "OGX_GLOBAL",
  "capabilities": [
    "JURISDICTION_MODELING",
    "REGION_MODELING",
    "REGISTRAR_MODELING",
    "PROVIDER_RELATIONSHIP_MODELING"
  ],
  "interfaces": [
    "OGX_PRIME_GOVERNED_CONTRACT",
    "SYSTEM_FOUNDRY_R1"
  ],
  "runtime_profiles": [
    "DEBIAN_13_X86_64",
    "REPOSITORY_BLUEPRINT"
  ],
  "effect_classes": [
    "E0_NO_EXTERNAL_EFFECT"
  ]
}

