{
  "system_ref": "HORIZON.OS",
  "domain_ref": "OGX_HORIZON",
  "capabilities": [
    "FEDERATION_DIRECTORY",
    "ROUTING_DISCOVERY",
    "PUBLIC_DISCOVERY",
    "FEDERATION_PROJECTION"
  ],
  "interfaces": [
    "OGX_PRIME_GOVERNED_CONTRACT",
    "SYSTEM_FOUNDRY_R1"
  ],
  "runtime_profiles": [
    "DEBIAN_13_X86_64",
    "REPOSITORY_BLUEPRINT"
  ],
  "effect_classes": [
    "E0_NO_EXTERNAL_EFFECT"
  ]
}

