{
  "system_ref": "SHOP.OS",
  "domain_ref": "OGX_SHOP",
  "capabilities": [
    "COMMERCE_MODELING",
    "ORDER_MODELING",
    "PAYMENT_BOUNDARIES",
    "ENTITLEMENT_MODELING",
    "FULFILLMENT_MODELING"
  ],
  "interfaces": [
    "OGX_PRIME_GOVERNED_CONTRACT",
    "SYSTEM_FOUNDRY_R1"
  ],
  "runtime_profiles": [
    "DEBIAN_13_X86_64",
    "REPOSITORY_BLUEPRINT"
  ],
  "effect_classes": [
    "E0_NO_EXTERNAL_EFFECT"
  ]
}
