{
  "system_ref": "ACADEMY.OS",
  "domain_ref": "OGX_ACADEMY",
  "capabilities": [
    "LEARNING_PATHWAYS",
    "KNOWLEDGE_MODELING",
    "LITERATURE_WORKFLOWS",
    "QUALIFICATION_PATHWAYS"
  ],
  "interfaces": [
    "OGX_PRIME_GOVERNED_CONTRACT",
    "SYSTEM_FOUNDRY_R1"
  ],
  "runtime_profiles": [
    "DEBIAN_13_X86_64",
    "REPOSITORY_BLUEPRINT"
  ],
  "effect_classes": [
    "E0_NO_EXTERNAL_EFFECT"
  ]
}

